doc_id,titulo,source_type,texto,language,clean_length_chars,clean_length_words
a8ded18f-017e-4d68-9b6c-36c2572aba8c,The repeatability and efficiency of a,Articulo_Academico,"The repeatability and efficiency of a corner detector determines how likely it is to be useful in a real-world application. The repeatability is importand because the same scene viewed from different positions should yield features which correspond to the same real-world 3D locations [Schmid et al 2000]. The efficiency is important because this determines whether the detector combined with further processing can operate at frame rate. Three advances are described in this paper. First, we present a new heuristic for feature detection, and using machine learning we derive a feature detector from this which can fully process live PAL video using less than 5% of the available processing time. By comparison, most other detectors cannot even operate at frame rate (Harris detector 115%, SIFT 195%). Second, we generalize the detector, allowing it to be optimized for repeatability, with little loss of efficiency. Third, we carry out a rigorous comparison of corner detectors based on the above repeatability criterion applied to 3D scenes. We show that despite being principally constructed for speed, on these stringent tests, our heuristic detector significantly outperforms existing feature detectors. Finally, the comparison demonstrates that using machine learning produces significant improvements in repeatability, yielding a detector that is both very fast and very high quality.",en,1392,208
26d2f596-cb02-47da-9b99-222bb67d6cf8,We analyze the convergence behaviour of,Articulo_Academico,"We analyze the convergence behaviour of a recently proposed algorithm for regularized estimation called Dual Augmented Lagrangian (DAL). Our analysis is based on a new interpretation of DAL as a proximal minimization algorithm. We theoretically show under some conditions that DAL converges super-linearly in a non-asymptotic and global sense. Due to a special modelling of sparse estimation problems in the context of machine learning, the assumptions we make are milder and more natural than those made in conventional analysis of augmented Lagrangian algorithms. In addition, the new interpretation enables us to generalize DAL to wide varieties of sparse estimation problems. We experimentally confirm our analysis in a large scale $\ell_1$-regularized logistic regression problem and extensively compare the efficiency of DAL algorithm to previously proposed algorithms on both synthetic and benchmark datasets.",en,916,131
804e791d-c4fa-4899-91e9-56631bb577da,Contexto: List all branches in a,Tutorial_Codigo,Contexto: List all branches in a Git repository Código de ejemplo: ```python ```python import os os.system('git branch') ``` ```,en,128,19
555f7fee-2405-45c1-a2e8-39610da377d1,Most generalization bounds in learning theory,Articulo_Academico,"Most generalization bounds in learning theory are based on some measure of the complexity of the hypothesis class used, independently of any algorithm. In contrast, the notion of algorithmic stability can be used to derive tight generalization bounds that are tailored to specific learning algorithms by exploiting their particular properties. However, as in much of learning theory, existing stability analyses and bounds apply only in the scenario where the samples are independently and identically distributed. In many machine learning applications, however, this assumption does not hold. The observations received by the learning algorithm often have some inherent temporal dependence. This paper studies the scenario where the observations are drawn from a stationary phi-mixing or beta-mixing sequence, a widely adopted assumption in the study of non-i.i.d. processes that implies a dependence between observations weakening over time. We prove novel and distinct stability-based generalization bounds for stationary phi-mixing and beta-mixing sequences. These bounds strictly generalize the bounds given in the i.i.d. case and apply to all stable learning algorithms, thereby extending the use of stability-bounds to non-i.i.d. scenarios. We also illustrate the application of our phi-mixing generalization bounds to general classes of learning algorithms, including Support Vector Regression, Kernel Ridge Regression, and Support Vector Machines, and many other kernel regularization-based and relative entropy-based regularization algorithms. These novel bounds can thus be viewed as the first theoretical basis for the use of these algorithms in non-i.i.d. scenarios.",en,1679,234
4cfc9800-eda5-4b9d-8b6e-c7399f125b7a,Contexto: Proceed with file I/O operations,Tutorial_Codigo,"Contexto: Proceed with file I/O operations Código de ejemplo: ```python ```python with open('example.txt', 'w') as f: f.write('Hello, World!') with open('example.txt', 'r') as f: content = f.read() print(f'File content: {content}') ``` ```",en,239,31
41cd0ad9-89ab-4a79-95ec-d10b08b5374b,Contexto: Create a simple HTTP server,Tutorial_Codigo,"Contexto: Create a simple HTTP server Código de ejemplo: ```python ```python from http.server import HTTPServer, SimpleHTTPRequestHandler httpd = HTTPServer(('localhost', 8000), SimpleHTTPRequestHandler) httpd.serve_forever() ``` ```",en,233,24
57f53c54-7b88-473d-b24e-7fa5d49897c6,Contexto: Debug using pdb Código de,Tutorial_Codigo,Contexto: Debug using pdb Código de ejemplo: ```python ```python import pdb x = 10 y = 0 pdb.set_trace() result = x / y ``` ```,es,127,25
de4ff8d7-1299-4d31-80c2-7f0541e55dcd,Contexto: Scrape and store tweets Código,Tutorial_Codigo,"Contexto: Scrape and store tweets Código de ejemplo: ```python ```python import tweepy auth = tweepy.OAuthHandler('consumer_key', 'consumer_secret') auth.set_access_token('access_token', 'access_secret') api = tweepy.API(auth) tweets = api.user_timeline(screen_name='username', count=10) with open('tweets.txt', 'w') as f: for tweet in tweets: f.write(tweet.text + '\n') ``` ```",en,378,39
48e7bc23-fb80-4f6f-a8fa-f78854a67454,Contexto: Search for a 4K TV,Tutorial_Codigo,"Contexto: Search for a 4K TV on Ceneo with Polish query Código de ejemplo: ```python ```python import requests from bs4 import BeautifulSoup def p_c(q): q = q.replace(' ', '+') u = f' res = requests.get(u) s = BeautifulSoup(res.text, 'html.parser') p = s.find('span', {'class': 'price'}) return p.text if p else 'Not found' print(p_c('telewizor 4K')) ``` ```",en,358,55
992ac875-659d-4a9b-9d24-8b5db6b3371f,Traffic forecasting from past observed traffic,Articulo_Academico,"Traffic forecasting from past observed traffic data with small calculation complexity is one of important problems for planning of servers and networks. Focusing on World Wide Web (WWW) traffic as fundamental investigation, this paper would deal with Bayesian forecasting of network traffic on the time varying Poisson model from a viewpoint from statistical decision theory. Under this model, we would show that the estimated forecasting value is obtained by simple arithmetic calculation and expresses real WWW traffic well from both theoretical and empirical points of view.",en,577,86
4be1598d-49d2-449d-a695-1e9f7756b892,"The recognition, involvement, and description of",Articulo_Academico,"The recognition, involvement, and description of main actors influences the story line of the whole text. This is of higher importance as the text per se represents a flow of words and expressions that once it is read it is lost. In this respect, the understanding of a text and moreover on how the actor exactly behaves is not only a major concern: as human beings try to store a given input on short-term memory while associating diverse aspects and actors with incidents, the following approach represents a virtual architecture, where collocations are concerned and taken as the associative completion of the actors' acting. Once that collocations are discovered, they become managed in separated memory blocks broken down by the actors. As for human beings, the memory blocks refer to associative mind-maps. We then present several priority functions to represent the actual temporal situation inside a mind-map to enable the user to reconstruct the recent events from the discovered temporal results.",en,1006,161
9c66c186-409a-4d66-bde8-012ba64a304d,Contexto: Remove all print statements from,Tutorial_Codigo,"Contexto: Remove all print statements from a Python file Código de ejemplo: ```python ```python file_path = input('Enter the Python file path: ') with open(file_path, 'r+') as f: lines = [line for line in f.readlines() if 'print(' not in line] f.seek(0) f.writelines(lines) f.truncate() ``` ```",en,294,44
97265f7b-dc65-4856-91cc-0f247a5f0143,Associative Classifier is a novel technique,Articulo_Academico,"Associative Classifier is a novel technique which is the integration of Association Rule Mining and Classification. The difficult task in building Associative Classifier model is the selection of relevant rules from a large number of class association rules (CARs). A very popular method of ordering rules for selection is based on confidence, support and antecedent size (CSA). Other methods are based on hybrid orderings in which CSA method is combined with other measures. In the present work, we study the effect of using different interestingness measures of Association rules in CAR rule ordering and selection for associative classifier.",en,644,98
b27c9d7a-362b-4ec9-b843-14763922db29,Contexto: Find newly added series on,Tutorial_Codigo,"Contexto: Find newly added series on Hulu Código de ejemplo: ```python ```python import requests from bs4 import BeautifulSoup response = requests.get(' soup = BeautifulSoup(response.text, 'html.parser') new_series = soup.select('.new-series-title') for series in new_series[:5]: print(series.text) ``` ```",en,306,35
b93c0636-8a9b-4f00-843b-785832b77f34,In this paper we derive the,Articulo_Academico,"In this paper we derive the equations for Loop Corrected Belief Propagation on a continuous variable Gaussian model. Using the exactness of the averages for belief propagation for Gaussian models, a different way of obtaining the covariances is found, based on Belief Propagation on cavity graphs. We discuss the relation of this loop correction algorithm to Expectation Propagation algorithms for the case in which the model is no longer Gaussian, but slightly perturbed by nonlinear terms.",en,491,76
e9d2f16b-2ba0-4def-9f98-83400d4b6149,We analyze and evaluate an online,Articulo_Academico,"We analyze and evaluate an online gradient descent algorithm with adaptive per-coordinate adjustment of learning rates. Our algorithm can be thought of as an online version of batch gradient descent with a diagonal preconditioner. This approach leads to regret bounds that are stronger than those of standard online gradient descent for general online convex optimization problems. Experimentally, we show that our algorithm is competitive with state-of-the-art algorithms for large scale machine learning problems.",en,515,73
e39a3455-3058-4d7c-ab1c-8552b1372ceb,Contexto: List all text files in,Tutorial_Codigo,Contexto: List all text files in directory C:\Documents Código de ejemplo: ```python ```python import os folder = 'C:\\Documents' text_files = [f for f in os.listdir(folder) if f.endswith('.txt')] print(text_files) ``` ```,en,222,30
ec435313-1596-46aa-9275-058298118398,Contexto: Automate Google Search for 'Python,Tutorial_Codigo,"Contexto: Automate Google Search for 'Python Tutorials Código de ejemplo: ```python ```python from googlesearch import search query = 'Python tutorials' for j in search(query, num_results=10): print(j) ``` ```",en,209,28
d179a507-908c-42e9-b841-7cbdf2c93962,There has been a lot of,Articulo_Academico,"There has been a lot of recent work on Bayesian methods for reinforcement learning exhibiting near-optimal online performance. The main obstacle facing such methods is that in most problems of interest, the optimal solution involves planning in an infinitely large tree. However, it is possible to obtain stochastic lower and upper bounds on the value of each tree node. This enables us to use stochastic branch and bound algorithms to search the tree efficiently. This paper proposes two such algorithms and examines their complexity in this setting.",en,551,87
189d64d1-1a50-4818-b67e-df83ed0cfc72,Contexto: Sniffing packets with tcpdump in,Tutorial_Codigo,Contexto: Sniffing packets with tcpdump in Linux Código de ejemplo: ```python ```python #!/bin/bash sudo tcpdump -i eth0 ``` ```,en,128,19
69aee918-3a97-4939-9a3e-cb4fdb22d78e,Contexto: Execute shell commands Código de,Tutorial_Codigo,"Contexto: Execute shell commands Código de ejemplo: ```python ```python import subprocess subprocess.run(['ls', '-l']) ``` ```",en,126,15
e5b12b26-2c2d-4c10-bca6-8705a351106b,Inferring the sequence of states from,Articulo_Academico,"Inferring the sequence of states from observations is one of the most fundamental problems in Hidden Markov Models. In statistical physics language, this problem is equivalent to computing the marginals of a one-dimensional model with a random external field. While this task can be accomplished through transfer matrix methods, it becomes quickly intractable when the underlying state space is large. This paper develops several low-complexity approximate algorithms to address this inference problem when the state space becomes large. The new algorithms are based on various mean-field approximations of the transfer matrix. Their performances are studied in detail on a simple realistic model for DNA pyrosequencing.",en,720,105
be875b82-506c-4a42-8b52-77ef1c9bd816,We present a streaming model for,Articulo_Academico,"We present a streaming model for large-scale classification (in the context of $\ell_2$-SVM) by leveraging connections between learning and computational geometry. The streaming model imposes the constraint that only a single pass over the data is allowed. The $\ell_2$-SVM is known to have an equivalent formulation in terms of the minimum enclosing ball (MEB) problem, and an efficient algorithm based on the idea of \emph{core sets} exists (Core Vector Machine, CVM). CVM learns a $(1+\varepsilon)$-approximate MEB for a set of points and yields an approximate solution to corresponding SVM instance. However CVM works in batch mode requiring multiple passes over the data. This paper presents a single-pass SVM which is based on the minimum enclosing ball of streaming data. We show that the MEB updates for the streaming case can be easily adapted to learn the SVM weight vector in a way similar to using online stochastic gradient updates. Our algorithm performs polylogarithmic computation at each example, and requires very small and constant storage. Experimental results show that, even in such restrictive settings, we can learn efficiently in just one pass and get accuracies comparable to other state-of-the-art SVM solvers (batch and online). We also give an analysis of the algorithm, and discuss some open issues and possible extensions.",en,1353,209
1938117b-b192-45c4-8465-b756654061fc,Hidden Markov Models (HMMs) are one,Articulo_Academico,"Hidden Markov Models (HMMs) are one of the most fundamental and widely used statistical tools for modeling discrete time series. In general, learning HMMs from data is computationally hard (under cryptographic assumptions), and practitioners typically resort to search heuristics which suffer from the usual local optima issues. We prove that under a natural separation condition (bounds on the smallest singular value of the HMM parameters), there is an efficient and provably correct algorithm for learning HMMs. The sample complexity of the algorithm does not explicitly depend on the number of distinct (discrete) observations---it implicitly depends on this quantity through spectral properties of the underlying HMM. This makes the algorithm particularly applicable to settings with a large number of observations, such as those in natural language processing where the space of observation is sometimes the words in a language. The algorithm is also simple, employing only a singular value decomposition and matrix multiplications.",en,1038,152
f7b9cd20-a3a5-46b0-b74f-9d1dd920cd9e,Contexto: Determine the most efficient route,Tutorial_Codigo,Contexto: Determine the most efficient route for my errands! Código de ejemplo: ```python ```python locations = [] while True: location = input('Enter a location for your errands or type 'done' to finish: ') if location == 'done': break locations.append(location) # Assuming first location is the starting point print(f'The most efficient route: {locations[0]} -> {' -> '.join(sorted(locations[1:]))} -> {locations[0]}') ``` ```,en,428,60
efb7ce63-cf21-4c0e-9390-93a7d42cf81f,Current methods for determining whether a,Articulo_Academico,"Current methods for determining whether a time series exhibits fractal structure (FS) rely on subjective assessments on estimators of the Hurst exponent (H). Here, I introduce the Bayesian Assessment of Scaling, an analytical framework for drawing objective and accurate inferences on the FS of time series. The technique exploits the scaling property of the diffusion associated to a time series. The resulting criterion is simple to compute and represents an accurate characterization of the evidence supporting different hypotheses on the scaling regime of a time series. Additionally, a closed-form Maximum Likelihood estimator of H is derived from the criterion, and this estimator outperforms the best available estimators.",en,729,107
b19aa022-2793-4eaa-a18a-a2d2aea59b77,"Next to the shortest path distance,",Articulo_Academico,"Next to the shortest path distance, the second most popular distance function between vertices in a graph is the commute distance (resistance distance). For two vertices u and v, the hitting time H_{uv} is the expected time it takes a random walk to travel from u to v. The commute time is its symmetrized version C_{uv} = H_{uv} + H_{vu}. In our paper we study the behavior of hitting times and commute distances when the number n of vertices in the graph is very large. We prove that as n converges to infinty, hitting times and commute distances converge to expressions that do not take into account the global structure of the graph at all. Namely, the hitting time H_{uv} converges to 1/d_v and the commute time to 1/d_u + 1/d_v where d_u and d_v denote the degrees of vertices u and v. In these cases, the hitting and commute times are misleading in the sense that they do not provide information about the structure of the graph. We focus on two major classes of random graphs: random geometric graphs (k-nearest neighbor graphs, epsilon-graphs, Gaussian similarity graphs) and random graphs with given expected degrees (in particular, Erdos-Renyi graphs with and without planted partitions)",en,1198,203
80bfa449-cce6-44e4-b8e4-94a42a181736,"In the constraint satisfaction problem ($CSP$),",Articulo_Academico,"In the constraint satisfaction problem ($CSP$), the aim is to find an assignment of values to a set of variables subject to specified constraints. In the minimum cost homomorphism problem ($MinHom$), one is additionally given weights $c_{va}$ for every variable $v$ and value $a$, and the aim is to find an assignment $f$ to the variables that minimizes $\sum_{v} c_{vf(v)}$. Let $MinHom(\Gamma)$ denote the $MinHom$ problem parameterized by the set of predicates allowed for constraints. $MinHom(\Gamma)$ is related to many well-studied combinatorial optimization problems, and concrete applications can be found in, for instance, defence logistics and machine learning. We show that $MinHom(\Gamma)$ can be studied by using algebraic methods similar to those used for CSPs. With the aid of algebraic techniques, we classify the computational complexity of $MinHom(\Gamma)$ for all choices of $\Gamma$. Our result settles a general dichotomy conjecture previously resolved only for certain classes of directed graphs, [Gutin, Hell, Rafiey, Yeo, European J. of Combinatorics, 2008].",en,1082,158
56b4fe09-8e86-4a22-911d-14336e52053c,Discovering latent representations of the observed,Articulo_Academico,"Discovering latent representations of the observed world has become increasingly more relevant in data analysis. Much of the effort concentrates on building latent variables which can be used in prediction problems, such as classification and regression. A related goal of learning latent structure from data is that of identifying which hidden common causes generate the observations, such as in applications that require predicting the effect of policies. This will be the main problem tackled in our contribution: given a dataset of indicators assumed to be generated by unknown and unmeasured common causes, we wish to discover which hidden common causes are those, and how they generate our data. This is possible under the assumption that observed variables are linear functions of the latent causes with additive noise. Previous results in the literature present solutions for the case where each observed variable is a noisy function of a single latent variable. We show how to extend the existing results for some cases where observed variables measure more than one latent variable.",en,1092,170
e62d2ec7-dea5-45f3-92ce-258ff1860761,Contexto: Move files from C:\Documents to,Tutorial_Codigo,"Contexto: Move files from C:\Documents to D:\Backup Código de ejemplo: ```python ```python import shutil import os src_folder = 'C:\\Documents' dest_folder = 'D:\\Backup' for filename in os.listdir(src_folder): shutil.move(os.path.join(src_folder, filename), os.path.join(dest_folder, filename)) ``` ```",en,303,32
92886089-d6de-45e3-9efe-1436cfa50055,Contexto: Check website availability Código de,Tutorial_Codigo,Contexto: Check website availability Código de ejemplo: ```python ```python import requests def check_website(url): try: response = requests.get(url) return response.status_code == 200 except requests.RequestException: return False ``` ```,fr,239,27
2bb3c235-aa7a-4f20-a9f6-0e016d163f57,Contexto: List top 5 rated products,Tutorial_Codigo,"Contexto: List top 5 rated products on eBay Código de ejemplo: ```python ```python import requests import json response = requests.get(' top_rated = json.loads(response.text)['itemSummaries'][:5] for product in top_rated: print(f'{product['title']}, Rating: {product['seller']['feedbackPercentage']}') ``` ```",en,309,32
c81f9658-579e-44b9-b39f-974c0927551e,A client-server architecture to simultaneously solve,Articulo_Academico,"A client-server architecture to simultaneously solve multiple learning tasks from distributed datasets is described. In such architecture, each client is associated with an individual learning task and the associated dataset of examples. The goal of the architecture is to perform information fusion from multiple datasets while preserving privacy of individual data. The role of the server is to collect data in real-time from the clients and codify the information in a common database. The information coded in this database can be used by all the clients to solve their individual learning task, so that each client can exploit the informative content of all the datasets without actually having access to private data of others. The proposed algorithmic framework, based on regularization theory and kernel methods, uses a suitable class of mixed effect kernels. The new method is illustrated through a simulated music recommendation system.",en,946,144
eca285c8-1004-41b0-be6e-e4d9d8680c4b,"The proposal is to use clusters,",Articulo_Academico,"The proposal is to use clusters, graphs and networks as models in order to analyse the Web structure. Clusters, graphs and networks provide knowledge representation and organization. Clusters were generated by co-site analysis. The sample is a set of academic Web sites from the countries belonging to the European Union. These clusters are here revisited from the point of view of graph theory and social network analysis. This is a quantitative and structural analysis. In fact, the Internet is a computer network that connects people and organizations. Thus we may consider it to be a social network. The set of Web academic sites represents an empirical social network, and is viewed as a virtual community. The network structural properties are here analysed applying together cluster analysis, graph theory and social network analysis.",en,841,132
8b64488b-e63b-4348-b3bc-8be88f591591,Contexto: Open Google Maps if I,Tutorial_Codigo,Contexto: Open Google Maps if I say 'I'm lost'! Código de ejemplo: ```python ```python import webbrowser if input() == 'I'm lost': webbrowser.open(' ``` ```,en,156,24
a78e8d8d-7e8d-4974-bd5c-6c88110a67f0,Contexto: Trace the WiFi networks Código,Tutorial_Codigo,"Contexto: Trace the WiFi networks Código de ejemplo: ```python ```python import subprocess result = subprocess.run(['netsh', 'wlan', 'show', 'networks'], stdout=subprocess.PIPE).stdout.decode() print('WiFi Networks:', result) ``` ```",en,233,24
