doc_id,titulo,source_type,texto,language,clean_length_chars,clean_length_words
2544b785-f1f9-42be-8aa6-598beee5e481,Given a random binary sequence $X^{(n)}$,Articulo_Academico,"Given a random binary sequence $X^{(n)}$ of random variables, $X_{t},$ $t=1,2,...,n$, for instance, one that is generated by a Markov source (teacher) of order $k^{*}$ (each state represented by $k^{*}$ bits). Assume that the probability of the event $X_{t}=1$ is constant and denote it by $\beta$. Consider a learner which is based on a parametric model, for instance a Markov model of order $k$, who trains on a sequence $x^{(m)}$ which is randomly drawn by the teacher. Test the learner's performance by giving it a sequence $x^{(n)}$ (generated by the teacher) and check its predictions on every bit of $x^{(n)}.$ An error occurs at time $t$ if the learner's prediction $Y_{t}$ differs from the true bit value $X_{t}$. Denote by $\xi^{(n)}$ the sequence of errors where the error bit $\xi_{t}$ at time $t$ equals 1 or 0 according to whether the event of an error occurs or not, respectively. Consider the subsequence $\xi^{(\nu)}$ of $\xi^{(n)}$ which corresponds to the errors of predicting a 0, i.e., $\xi^{(\nu)}$ consists of the bits of $\xi^{(n)}$ only at times $t$ such that $Y_{t}=0.$ In this paper we compute an estimate on the deviation of the frequency of 1s of $\xi^{(\nu)}$ from $\beta$. The result shows that the level of randomness of $\xi^{(\nu)}$ decreases relative to an increase in the complexity of the learner.",en,1334,219
81aa057a-72d1-4737-af72-fa1cf4350e06,Contexto: Find me the best day,Tutorial_Codigo,"Contexto: Find me the best day to book a flight Código de ejemplo: ```python ```python days = ['Monday', 'Tuesday', 'Wednesday', 'Thursday', 'Friday', 'Saturday', 'Sunday'] # Typically, flights are cheaper on Tuesdays and Wednesdays best_days = ['Tuesday', 'Wednesday'] print(f'The best days to book a flight are usually {best_days}') ``` ```",en,342,49
ae9d0a02-bba0-49ac-9dbc-28bcd1194083,Contexto: Disable Aero theme if RAM,Tutorial_Codigo,"Contexto: Disable Aero theme if RAM usage exceeds 80%! Código de ejemplo: ```python ```python import psutil import subprocess if psutil.virtual_memory().percent > 80: subprocess.run(['net', 'stop', 'uxsms']) ``` ```",en,215,27
83b9097f-1548-4664-a0fc-d89b605e333f,Median clustering extends popular neural data,Articulo_Academico,"Median clustering extends popular neural data analysis methods such as the self-organizing map or neural gas to general data structures given by a dissimilarity matrix only. This offers flexible and robust global data inspection methods which are particularly suited for a variety of data as occurs in biomedical domains. In this chapter, we give an overview about median clustering and its properties and extensions, with a particular focus on efficient implementations adapted to large scale data analysis.",en,508,77
b069e14b-0ce0-4b5e-8d64-27e53ac9b372,Contexto: Interact with a database Código,Tutorial_Codigo,"Contexto: Interact with a database Código de ejemplo: ```python ```python import sqlite3 conn = sqlite3.connect('example.db') c = conn.cursor() c.execute('CREATE TABLE IF NOT EXISTS users (name TEXT, age INTEGER)') c.execute('INSERT INTO users VALUES ('Alice', 30)') conn.commit() conn.close() ``` ```",en,301,38
b8a4743c-b051-42d5-a862-0b78a5ab54e3,Point clouds are sets of points,Articulo_Academico,"Point clouds are sets of points in two or three dimensions. Most kernel methods for learning on sets of points have not yet dealt with the specific geometrical invariances and practical constraints associated with point clouds in computer vision and graphics. In this paper, we present extensions of graph kernels for point clouds, which allow to use kernel methods for such ob jects as shapes, line drawings, or any three-dimensional point clouds. In order to design rich and numerically efficient kernels with as few free parameters as possible, we use kernels between covariance matrices and their factorizations on graphical models. We derive polynomial time dynamic programming recursions and present applications to recognition of handwritten digits and Chinese characters from few training examples.",en,806,122
c6ee6b45-cc28-4987-8887-86992c5f4c36,Contexto: Manage my email Código de,Tutorial_Codigo,"Contexto: Manage my email Código de ejemplo: ```python ```python import smtplib import imaplib # Send email server = smtplib.SMTP('smtp.gmail.com', 587) server.starttls() server.login('youremail@gmail.com', 'your-password') server.sendmail('from@gmail.com', 'to@gmail.com', 'Test email') # Read email mail = imaplib.IMAP4_SSL('imap.gmail.com') mail.login('youremail@gmail.com', 'your-password') mail.select('inbox') type, data = mail.search(None, 'ALL') mail_ids = data[0] id_list = mail_ids.split() latest_email_id = int(id_list[-1]) ``` ```",en,542,52
ce511fe7-f39c-4233-8735-4556f3adeee7,Covariances from categorical variables are defined,Articulo_Academico,"Covariances from categorical variables are defined using a regular simplex expression for categories. The method follows the variance definition by Gini, and it gives the covariance as a solution of simultaneous equations. The calculated results give reasonable values for test data. A method of principal component analysis (RS-PCA) is also proposed using regular simplex expressions, which allows easy interpretation of the principal components. The proposed methods apply to variable selection problem of categorical data USCensus1990 data. The proposed methods give appropriate criterion for the variable selection problem of categorical",en,641,89
a1f19c5b-2b4e-42d7-a867-4e599809aa52,Contexto: Install missing dependencies sniff and,Tutorial_Codigo,"Contexto: Install missing dependencies sniff and requests using pip Código de ejemplo: ```python ```python import subprocess # List of dependencies required_packages = ['sniff','requests'] # Install missing packages for package in required_packages: subprocess.run(['pip', 'install', package]) ``` ```",en,301,36
1a20319b-fa58-4690-8230-892c927fdba9,Contexto: Convert the following announcement about,Tutorial_Codigo,"Contexto: Convert the following announcement about Vera's Lobbies tournament into a markdown post: 'Exciting news! We're hosting a Vera's Lobbies tournament...' Código de ejemplo: ```python ```python # Exciting News: Vera's Lobbies Tournament! ## Date: October 30, 2023 **Prizes:** - 1st Place: $500 - 2nd Place: $300 ## How to Join: 1. Sign up on the website 2. Join the discord channel **Spread the word and let's make this a tournament to remember!** ``` ```",en,461,74
693ef3c6-514a-44f0-b323-a133d1391712,"In this contribution, we propose a",Articulo_Academico,"In this contribution, we propose a generic online (also sometimes called adaptive or recursive) version of the Expectation-Maximisation (EM) algorithm applicable to latent variable models of independent observations. Compared to the algorithm of Titterington (1984), this approach is more directly connected to the usual EM algorithm and does not rely on integration with respect to the complete data distribution. The resulting algorithm is usually simpler and is shown to achieve convergence to the stationary points of the Kullback-Leibler divergence between the marginal distribution of the observation and the model distribution at the optimal rate, i.e., that of the maximum likelihood estimator. In addition, the proposed approach is also suitable for conditional (or regression) models, as illustrated in the case of the mixture of linear regressions model.",en,865,126
55ebca39-66c6-4d0c-a417-cbeb39c7bdd4,The problem of joint universal source,Articulo_Academico,"The problem of joint universal source coding and modeling, treated in the context of lossless codes by Rissanen, was recently generalized to fixed-rate lossy coding of finitely parametrized continuous-alphabet i.i.d. sources. We extend these results to variable-rate lossy block coding of stationary ergodic sources and show that, for bounded metric distortion measures, any finitely parametrized family of stationary sources satisfying suitable mixing, smoothness and Vapnik-Chervonenkis learnability conditions admits universal schemes for joint lossy source coding and identification. We also give several explicit examples of parametric sources satisfying the regularity conditions.",en,686,90
b2c48db2-2f9f-4ac3-b80d-fc591eeaad61,Contexto: Switch to high-performance power plan,Tutorial_Codigo,"Contexto: Switch to high-performance power plan if plugged in! Código de ejemplo: ```python ```python import psutil import subprocess if psutil.sensors_battery().power_plugged: subprocess.run(['powercfg', '-setactive', '8c5e7fda-e8bf-4a96-9a85-a6e23a8c635c']) ``` ```",en,267,25
3aee3ee0-44b9-4c47-bdef-d2912fa0997a,Contexto: Capture webcam video Código de,Tutorial_Codigo,"Contexto: Capture webcam video Código de ejemplo: ```python ```python import cv2 cap = cv2.VideoCapture(0) while True: ret, frame = cap.read() cv2.imshow('Webcam', frame) if cv2.waitKey(1) == ord('q'): break cap.release() cv2.destroyAllWindows() ``` ```",en,253,31
151b1837-ca0f-48f9-858b-850ef7651852,We study the problem of decision-theoretic,Articulo_Academico,"We study the problem of decision-theoretic online learning (DTOL). Motivated by practical applications, we focus on DTOL when the number of actions is very large. Previous algorithms for learning in this framework have a tunable learning rate parameter, and a barrier to using online-learning in practical applications is that it is not understood how to set this parameter optimally, particularly when the number of actions is large. In this paper, we offer a clean solution by proposing a novel and completely parameter-free algorithm for DTOL. We introduce a new notion of regret, which is more natural for applications with a large number of actions. We show that our algorithm achieves good performance with respect to this new notion of regret; in addition, it also achieves performance close to that of the best bounds achieved by previous algorithms with optimally-tuned parameters, according to previous notions of regret.",en,931,146
4d122f4c-b41e-489a-adcf-4284f6666c54,Contexto: Implement a Random Forest Classifier,Tutorial_Codigo,"Contexto: Implement a Random Forest Classifier using scikit-learn Código de ejemplo: ```python ```python from sklearn.ensemble import RandomForestClassifier from sklearn.datasets import load_iris X, y = load_iris(return_X_y=True) clf = RandomForestClassifier(n_estimators=100) clf.fit(X, y) ``` ```",en,298,32
585ac675-504b-465e-a0f6-2ef02dbc3e4a,Contexto: Suggest me a game based,Tutorial_Codigo,Contexto: Suggest me a game based on my hardware specs Código de ejemplo: ```python ```python ram = int(input('Enter your RAM size in GB: ')) if ram >= 16: print('You should play Cyberpunk 2077.') ``` ```,en,204,35
06892583-f0f4-4405-88a6-348934c75b04,We consider the problem of estimating,Articulo_Academico,"We consider the problem of estimating the parameters of a Gaussian or binary distribution in such a way that the resulting undirected graphical model is sparse. Our approach is to solve a maximum likelihood problem with an added l_1-norm penalty term. The problem as formulated is convex but the memory requirements and complexity of existing interior point methods are prohibitive for problems with more than tens of nodes. We present two new algorithms for solving problems with at least a thousand nodes in the Gaussian case. Our first algorithm uses block coordinate descent, and can be interpreted as recursive l_1-norm penalized regression. Our second algorithm, based on Nesterov's first order method, yields a complexity estimate with a better dependence on problem size than existing interior point methods. Using a log determinant relaxation of the log partition function (Wainwright & Jordan (2006)), we show that these same algorithms can be used to solve an approximate sparse maximum likelihood problem for the binary case. We test our algorithms on synthetic data, as well as on gene expression and senate voting records data.",en,1141,180
5e7e5ff3-2f09-46b7-83be-89a5c539b29c,Pac-Bayes bounds are among the most,Articulo_Academico,"Pac-Bayes bounds are among the most accurate generalization bounds for classifiers learned from independently and identically distributed (IID) data, and it is particularly so for margin classifiers: there have been recent contributions showing how practical these bounds can be either to perform model selection (Ambroladze et al., 2007) or even to directly guide the learning of linear classifiers (Germain et al., 2009). However, there are many practical situations where the training data show some dependencies and where the traditional IID assumption does not hold. Stating generalization bounds for such frameworks is therefore of the utmost interest, both from theoretical and practical standpoints. In this work, we propose the first - to the best of our knowledge - Pac-Bayes generalization bounds for classifiers trained on data exhibiting interdependencies. The approach undertaken to establish our results is based on the decomposition of a so-called dependency graph that encodes the dependencies within the data, in sets of independent data, thanks to graph fractional covers. Our bounds are very general, since being able to find an upper bound on the fractional chromatic number of the dependency graph is sufficient to get new Pac-Bayes bounds for specific settings. We show how our results can be used to derive bounds for ranking statistics (such as Auc) and classifiers trained on data distributed according to a stationary {\ss}-mixing process. In the way, we show how our approach seemlessly allows us to deal with U-processes. As a side note, we also provide a Pac-Bayes generalization bound for classifiers learned on data from stationary $\varphi$-mixing distributions.",en,1695,257
d96ec355-a3c5-4d5d-b941-9fee612ff397,Contexto: Automate price tracking on Amazon,Tutorial_Codigo,"Contexto: Automate price tracking on Amazon Código de ejemplo: ```python ```python import requests from bs4 import BeautifulSoup URL = ' headers = {'User-Agent': 'your_user_agent'} response = requests.get(URL, headers=headers) soup = BeautifulSoup(response.content, 'html.parser') price = soup.find(id='priceblock_ourprice').get_text() print(f'Current price is {price}') ``` ```",en,378,41
85430316-7120-4b42-91e9-60c4058467c0,We present multiplicative updates for solving,Articulo_Academico,"We present multiplicative updates for solving hard and soft margin support vector machines (SVM) with non-negative kernels. They follow as a natural extension of the updates for non-negative matrix factorization. No additional param- eter setting, such as choosing learning, rate is required. Ex- periments demonstrate rapid convergence to good classifiers. We analyze the rates of asymptotic convergence of the up- dates and establish tight bounds. We test the performance on several datasets using various non-negative kernels and report equivalent generalization errors to that of a standard SVM.",en,599,87
f75d2a68-7128-491a-9e98-bec1c27342c8,A mechanism called Eligibility Propagation is,Articulo_Academico,A mechanism called Eligibility Propagation is proposed to speed up the Time Hopping technique used for faster Reinforcement Learning in simulations. Eligibility Propagation provides for Time Hopping similar abilities to what eligibility traces provide for conventional Reinforcement Learning. It propagates values from one state to all of its temporal predecessors using a state transitions graph. Experiments on a simulated biped crawling robot confirm that Eligibility Propagation accelerates the learning process more than 3 times.,en,534,74
0ead10ff-e52a-4f42-a8e5-9ef952355db5,We study the empirical meaning of,Articulo_Academico,"We study the empirical meaning of randomness with respect to a family of probability distributions $P_\theta$, where $\theta$ is a real parameter, using algorithmic randomness theory. In the case when for a computable probability distribution $P_\theta$ an effectively strongly consistent estimate exists, we show that the Levin's a priory semicomputable semimeasure of the set of all $P_\theta$-random sequences is positive if and only if the parameter $\theta$ is a computable real number. The different methods for generating ``meaningful'' $P_\theta$-random sequences with noncomputable $\theta$ are discussed.",en,614,85
ee560ae0-9798-4455-9b1a-0a1d525eac6a,Adaptive control problems are notoriously difficult,Articulo_Academico,"Adaptive control problems are notoriously difficult to solve even in the presence of plant-specific controllers. One way to by-pass the intractable computation of the optimal policy is to restate the adaptive control as the minimization of the relative entropy of a controller that ignores the true plant dynamics from an informed controller. The solution is given by the Bayesian control rule-a set of equations characterizing a stochastic adaptive controller for the class of possible plant dynamics. Here, the Bayesian control rule is applied to derive BCR-MDP, a controller to solve undiscounted Markov decision processes with finite state and action spaces and unknown dynamics. In particular, we derive a non-parametric conjugate prior distribution over the policy space that encapsulates the agent's whole relevant history and we present a Gibbs sampler to draw random policies from this distribution. Preliminary results show that BCR-MDP successfully avoids sub-optimal limit cycles due to its built-in mechanism to balance exploration versus exploitation.",en,1065,156
3a0ed4dc-f95d-4dbf-82f9-1e6c5fe86ea1,Contexto: Open a random browser tab,Tutorial_Codigo,Contexto: Open a random browser tab from a list of my favorite websites Código de ejemplo: ```python ```python import random import webbrowser websites = [' ' ' webbrowser.open(random.choice(websites)) ``` ```,en,209,30
9f9590d2-b6a7-4516-ae77-a53ee995479e,Approximate message passing algorithms proved to,Articulo_Academico,"Approximate message passing algorithms proved to be extremely effective in reconstructing sparse signals from a small number of incoherent linear measurements. Extensive numerical experiments further showed that their dynamics is accurately tracked by a simple one-dimensional iteration termed state evolution. In this paper we provide the first rigorous foundation to state evolution. We prove that indeed it holds asymptotically in the large system limit for sensing matrices with independent and identically distributed gaussian entries. While our focus is on message passing algorithms for compressed sensing, the analysis extends beyond this setting, to a general class of algorithms on dense graphs. In this context, state evolution plays the role that density evolution has for sparse graphs. The proof technique is fundamentally different from the standard approach to density evolution, in that it copes with large number of short loops in the underlying factor graph. It relies instead on a conditioning technique recently developed by Erwin Bolthausen in the context of spin glass theory.",en,1099,162
ead54a2f-0750-4e75-a2dd-f29ae241259b,Contexto: Proceed with parsing command-line arguments,Tutorial_Codigo,"Contexto: Proceed with parsing command-line arguments Código de ejemplo: ```python ```python import argparse parser = argparse.ArgumentParser() parser.add_argument('--arg1', help='description for arg1') args = parser.parse_args() print(args.arg1) ``` ```",en,254,26
34de02c3-e6e0-46a3-867e-4c971eeae74e,Contexto: Eject external drives if battery,Tutorial_Codigo,"Contexto: Eject external drives if battery below 5%! Código de ejemplo: ```python ```python import psutil import os if psutil.sensors_battery().percent < 5: os.system('RunDll32.exe shell32.dll,Control_RunDLL hotplug.dll') ``` ```",en,229,26
8126d4ed-0a44-4ffa-af04-e406c3806ca5,Contexto: Set up a VPN connection,Tutorial_Codigo,Contexto: Set up a VPN connection in Linux Código de ejemplo: ```python ```python #!/bin/bash sudo openvpn --config /path/to/config.ovpn ``` ```,en,144,20
1dc3e9a4-1358-4a64-8be2-a07f97dee438,Contexto: Show the system's time zone,Tutorial_Codigo,"Contexto: Show the system's time zone Código de ejemplo: ```python ```python import time time_zone = time.tzname print('System Time Zone:', time_zone) ``` ```",en,158,22
959715ff-4c03-43bd-a49d-a1f23d48e2a1,We describe an approach to domain,Articulo_Academico,"We describe an approach to domain adaptation that is appropriate exactly in the case when one has enough ``target'' data to do slightly better than just using only ``source'' data. Our approach is incredibly simple, easy to implement as a preprocessing step (10 lines of Perl!) and outperforms state-of-the-art approaches on a range of datasets. Moreover, it is trivially extended to a multi-domain adaptation problem, where one has data from a variety of different domains.",en,474,75
da96013d-2af3-46d6-96cf-d3d950d01079,Contexto: Convert the following user testimonials,Tutorial_Codigo,"Contexto: Convert the following user testimonials for Vera's Lobbies into a longer markdown post: 'Our users share their long-term experiences with Vera?s Lobbies...' Código de ejemplo: ```python ```python # Long-Term User Testimonials for Vera's Lobbies Hear what our users have to say after using Vera's Lobbies for more than a year. ## Testimonial 1: **Username**: JohnDoe > I've been using Vera's Lobbies for over a year, and the updates have been fantastic. The developers really listen to the community. ## Testimonial 2: **Username**: JaneDoe > The security features are robust, and I've never felt safer using an online service. Keep up the good work! ## Testimonial 3: **Username**: Gamer2023 > It has a bit of a learning curve, but once you get the hang of it, it's incredibly powerful. Definitely worth the investment of time. **Share your own experience on our [Forum]( ``` ```",en,889,144
a95959bd-842b-48b7-8ccf-3119d1ffc3c5,Cooperative decision making is a vision,Articulo_Academico,"Cooperative decision making is a vision of future network management and control. Distributed connection preemption is an important example where nodes can make intelligent decisions on allocating resources and controlling traffic flows for multi-class service networks. A challenge is that nodal decisions are spatially dependent as traffic flows trespass multiple nodes in a network. Hence the performance-complexity trade-off becomes important, i.e., how accurate decisions are versus how much information is exchanged among nodes. Connection preemption is known to be NP-complete. Centralized preemption is optimal but computationally intractable. Decentralized preemption is computationally efficient but may result in a poor performance. This work investigates distributed preemption where nodes decide whether and which flows to preempt using only local information exchange with neighbors. We develop, based on the probabilistic graphical models, a near-optimal distributed algorithm. The algorithm is used by each node to make collectively near-optimal preemption decisions. We study trade-offs between near-optimal performance and complexity that corresponds to the amount of information-exchange of the distributed algorithm. The algorithm is validated by both analysis and simulation.",en,1296,173
60923fbc-f81c-42ca-94dd-2a26dc44aab2,Contexto: Run a MITM attack with,Tutorial_Codigo,Contexto: Run a MITM attack with Ettercap in Linux Código de ejemplo: ```python ```python #!/bin/bash sudo ettercap -T -q -i interface ``` ```,en,142,23
695b180b-40e2-4033-83c9-7e0f837a34c5,Contexto: Show the IP address Código,Tutorial_Codigo,"Contexto: Show the IP address Código de ejemplo: ```python ```python import socket ip_address = socket.gethostbyname(socket.gethostname()) print('IP Address:', ip_address) ``` ```",en,179,20
0a89d406-42ea-43cf-a899-d1d310cc5777,Contexto: Proceed with automating YouTube downloads,Tutorial_Codigo,Contexto: Proceed with automating YouTube downloads Código de ejemplo: ```python ```python from pytube import YouTube url = ' yt = YouTube(url) video = yt.streams.get_highest_resolution() video.download() ``` ```,en,212,27
69946ffb-bf95-4db5-b2ec-953f93b32d16,Contexto: Set a reminder... Código de,Tutorial_Codigo,Contexto: Set a reminder... Código de ejemplo: ```python ```python import schedule import time reminder_message = input('Please enter the reminder message: ') reminder_time = input('Please enter the time for the reminder in HH:MM format: ') def remind(): print(reminder_message) schedule.every().day.at(reminder_time).do(remind) while True: schedule.run_pending() time.sleep(1) ``` ```,en,385,44
