doc_id,titulo,source_type,texto,language,clean_length_chars,clean_length_words
56bc8ec1-4e0e-44f6-a787-3c1b441ba751,Contexto: Search for a text pattern,Tutorial_Codigo,Contexto: Search for a text pattern in multiple files Código de ejemplo: ```python ```python import os pattern = input('Enter the text pattern to search for: ') folder = input('Enter the directory to search in: ') os.system(f'grep -rnl {folder} -e {pattern}') ``` ```,en,267,42
0cea7e84-7034-4fa6-b157-3fc062ce00da,Contexto: Profile code execution time: {code},Tutorial_Codigo,Contexto: Profile code execution time: {code} Código de ejemplo: ```python ```python import timeit start_time = timeit.default_timer() {code} end_time = timeit.default_timer() print(f'Execution time: {end_time - start_time}') ``` ```,fr,233,27
31c3ea14-d797-4065-a5fc-23e4ba0ef54e,Contexto: Send a weekly scheduled email,Tutorial_Codigo,"Contexto: Send a weekly scheduled email with the subject 'Weekly Summary' Código de ejemplo: ```python ```python import smtplib, schedule, time def se(): s = smtplib.SMTP('smtp.gmail.com', 587) s.starttls() s.login('weeklysummary@gmail.com', 'abcdef1234567890') s.sendmail('weeklysummary@gmail.com', 'weeklysummary@gmail.com', 'Subject: Weekly Summary This is a weekly summary.') s.quit() print('E sent.') schedule.every().week.do(se) while True: schedule.run_pending() time.sleep(1) ``` ```",en,491,49
8cd4c184-4fa0-4550-bbf5-37b7be6c2556,"In this paper, we consider the",Articulo_Academico,"In this paper, we consider the nonasymptotic sequential estimation of means of random variables bounded in between zero and one. We have rigorously demonstrated that, in order to guarantee prescribed relative precision and confidence level, it suffices to continue sampling until the sample sum is no less than a certain bound and then take the average of samples as an estimate for the mean of the bounded random variable. We have developed an explicit formula and a bisection search method for the determination of such bound of sample sum, without any knowledge of the bounded variable. Moreover, we have derived bounds for the distribution of sample size. In the special case of Bernoulli random variables, we have established analytical and numerical methods to further reduce the bound of sample sum and thus improve the efficiency of sampling. Furthermore, the fallacy of existing results are detected and analyzed.",en,922,147
067195dc-34d2-4ea3-9d29-be40c123180e,Contexto: List all running Docker containers,Tutorial_Codigo,Contexto: List all running Docker containers Código de ejemplo: ```python ```python import os os.system('docker ps') ``` ```,en,124,17
99ea4820-aa15-4dac-9313-3621e71ce43e,Contexto: Square numbers in list using,Tutorial_Codigo,Contexto: Square numbers in list using list comprehension... Código de ejemplo: ```python ```python arr = [int(x) for x in input('Please enter numbers separated by space: ').split()] result = [x**2 for x in arr] print(result) ``` ```,en,233,36
31ca9e3b-e388-47dc-9f18-b65165dd71ba,We give a universal kernel that,Articulo_Academico,"We give a universal kernel that renders all the regular languages linearly separable. We are not able to compute this kernel efficiently and conjecture that it is intractable, but we do have an efficient $\eps$-approximation.",en,225,35
0e33c376-06c8-44b4-9a65-4eeb323fadaa,Contexto: Trace the list of logged-in,Tutorial_Codigo,"Contexto: Trace the list of logged-in users Código de ejemplo: ```python ```python import psutil users = psutil.users() print('Logged-in Users:', users) ``` ```",en,160,22
7e1bebd9-4f2b-400d-85b9-ebe78f63e1ed,We present a convex formulation of,Articulo_Academico,"We present a convex formulation of dictionary learning for sparse signal decomposition. Convexity is obtained by replacing the usual explicit upper bound on the dictionary size by a convex rank-reducing term similar to the trace norm. In particular, our formulation introduces an explicit trade-off between size and sparsity of the decomposition of rectangular matrices. Using a large set of synthetic examples, we compare the estimation abilities of the convex and non-convex approaches, showing that while the convex formulation has a single local minimum, this may lead in some cases to performance which is inferior to the local minima of the non-convex formulation.",en,670,102
aa4fc938-52e9-4f78-b2e1-13c91d0476b4,Contexto: Implement a simple chatbot using,Tutorial_Codigo,"Contexto: Implement a simple chatbot using Python's NLTK library Código de ejemplo: ```python ```python import nltk from nltk.chat.util import Chat, reflections pairs = [(r'hi', 'hello'), (r'how are you', 'I am fine')] chatbot = Chat(pairs, reflections) chatbot.converse() ``` ```",en,280,38
70ce068e-28ba-4d4d-9781-569c5df14e2c,A central problem in artificial intelligence,Articulo_Academico,"A central problem in artificial intelligence is that of planning to maximize future reward under uncertainty in a partially observable environment. In this paper we propose and demonstrate a novel algorithm which accurately learns a model of such an environment directly from sequences of action-observation pairs. We then close the loop from observations to actions by planning in the learned model and recovering a policy which is near-optimal in the original environment. Specifically, we present an efficient and statistically consistent spectral algorithm for learning the parameters of a Predictive State Representation (PSR). We demonstrate the algorithm by learning a model of a simulated high-dimensional, vision-based mobile robot planning task, and then perform approximate point-based planning in the learned PSR. Analysis of our results shows that the algorithm learns a state space which efficiently captures the essential features of the environment. This representation allows accurate prediction with a small number of parameters, and enables successful and efficient planning.",en,1094,157
aa630c0c-2b96-4667-8eb6-ab79c22d39bd,Catalogs of periodic variable stars contain,Articulo_Academico,"Catalogs of periodic variable stars contain large numbers of periodic light-curves (photometric time series data from the astrophysics domain). Separating anomalous objects from well-known classes is an important step towards the discovery of new classes of astronomical objects. Most anomaly detection methods for time series data assume either a single continuous time series or a set of time series whose periods are aligned. Light-curve data precludes the use of these methods as the periods of any given pair of light-curves may be out of sync. One may use an existing anomaly detection method if, prior to similarity calculation, one performs the costly act of aligning two light-curves, an operation that scales poorly to massive data sets. This paper presents PCAD, an unsupervised anomaly detection method for large sets of unsynchronized periodic time-series data, that outputs a ranked list of both global and local anomalies. It calculates its anomaly score for each light-curve in relation to a set of centroids produced by a modified k-means clustering algorithm. Our method is able to scale to large data sets through the use of sampling. We validate our method on both light-curve data and other time series data sets. We demonstrate its effectiveness at finding known anomalies, and discuss the effect of sample size and number of centroids on our results. We compare our method to naive solutions and existing time series anomaly detection methods for unphased data, and show that PCAD's reported anomalies are comparable to or better than all other methods. Finally, astrophysicists on our team have verified that PCAD finds true anomalies that might be indicative of novel astrophysical phenomena.",en,1717,269
1002614e-768a-426d-8c63-e540a5dbe942,Contexto: Network sniffing using ettercap in,Tutorial_Codigo,Contexto: Network sniffing using ettercap in Linux. Código de ejemplo: ```python ```python #!/bin/bash ettercap -T -i eth0 ``` ```,en,130,19
811efa9a-5f8f-423d-bec7-2419ff402124,The maze traversal problem (finding the,Articulo_Academico,"The maze traversal problem (finding the shortest distance to the goal from any position in a maze) has been an interesting challenge in computational intelligence. Recent work has shown that the cellular simultaneous recurrent neural network (CSRN) can solve this problem for simple mazes. This thesis focuses on exploiting relevant information about the maze to improve learning and decrease the training time for the CSRN to solve mazes. Appropriate variables are identified to create useful clusters using relevant information. The CSRN was next modified to allow for an additional external input. With this additional input, several methods were tested and results show that clustering the mazes improves the overall learning of the traversal problem for the CSRN.",en,768,117
7697cd80-112f-43e7-83f1-af66fda48bd2,We consider the problem of PAC-learning,Articulo_Academico,"We consider the problem of PAC-learning decision trees, i.e., learning a decision tree over the n-dimensional hypercube from independent random labeled examples. Despite significant effort, no polynomial-time algorithm is known for learning polynomial-sized decision trees (even trees of any super-constant size), even when examples are assumed to be drawn from the uniform distribution on {0,1}^n. We give an algorithm that learns arbitrary polynomial-sized decision trees for {\em most product distributions}. In particular, consider a random product distribution where the bias of each bit is chosen independently and uniformly from, say, [.49,.51]. Then with high probability over the parameters of the product distribution and the random examples drawn from it, the algorithm will learn any tree. More generally, in the spirit of smoothed analysis, we consider an arbitrary product distribution whose parameters are specified only up to a [-c,c] accuracy (perturbation), for an arbitrarily small positive constant c.",en,1021,147
4f151e12-8558-46a0-b56c-0b8203142dd2,The paper deals with on-line regression,Articulo_Academico,The paper deals with on-line regression settings with signals belonging to a Banach lattice. Our algorithms work in a semi-online setting where all the inputs are known in advance and outcomes are unknown and given step by step. We apply the Aggregating Algorithm to construct a prediction method whose cumulative loss over all the input vectors is comparable with the cumulative loss of any linear functional on the Banach lattice. As a by-product we get an algorithm that takes signals from an arbitrary domain. Its cumulative loss is comparable with the cumulative loss of any predictor function from Besov and Triebel-Lizorkin spaces. We describe several applications of our setting.,en,687,109
fa976c37-d3b0-4847-b766-851ed1e75ebf,Contexto: Fetch the latest gaming news,Tutorial_Codigo,"Contexto: Fetch the latest gaming news and display them interactively Código de ejemplo: ```python ```python import requests choice = input('Enter the gaming category you are interested in: ') response = requests.get(f' gaming_news = response.json()['articles'] for i, article in enumerate(gaming_news): print(f'{i+1}. {article['title']}') selection = int(input('Select an article to read: ')) print(gaming_news[selection-1]['content']) ``` ```",en,444,52
6899ea27-707d-4779-bfab-79ae95f77758,Semisupervised learning has emerged as a,Articulo_Academico,"Semisupervised learning has emerged as a popular framework for improving modeling accuracy while controlling labeling cost. Based on an extension of stochastic composite likelihood we quantify the asymptotic accuracy of generative semi-supervised learning. In doing so, we complement distribution-free analysis by providing an alternative framework to measure the value associated with different labeling policies and resolve the fundamental question of how much data to label and in what manner. We demonstrate our approach with both simulation studies and real world experiments using naive Bayes for text classification and MRFs and CRFs for structured prediction in NLP.",en,674,96
a38db305-ae04-4779-abb2-2b46039f742d,Contexto: Implement a Python script to,Tutorial_Codigo,"Contexto: Implement a Python script to perform web scraping and data extraction Código de ejemplo: ```python ```python import requests from bs4 import BeautifulSoup response = requests.get(' soup = BeautifulSoup(response.text, 'html.parser') title = soup.find('title').get_text() ``` ```",en,287,35
d51d1fcc-e876-4c9c-a7c2-ee9a98168896,This paper applies machine learning techniques,Articulo_Academico,"This paper applies machine learning techniques to student modeling. It presents a method for discovering high-level student behaviors from a very large set of low-level traces corresponding to problem-solving actions in a learning environment. Basic actions are encoded into sets of domain-dependent attribute-value patterns called cases. Then a domain-independent hierarchical clustering identifies what we call general attitudes, yielding automatic diagnosis expressed in natural language, addressed in principle to teachers. The method can be applied to individual students or to entire groups, like a class. We exhibit examples of this system applied to thousands of students' actions in the domain of algebraic transformations.",en,732,102
9bd49da6-9082-47e5-ac9a-7de2685ed432,"In this paper, we study the",Articulo_Academico,"In this paper, we study the application of sparse principal component analysis (PCA) to clustering and feature selection problems. Sparse PCA seeks sparse factors, or linear combinations of the data variables, explaining a maximum amount of variance in the data while having only a limited number of nonzero coefficients. PCA is often used as a simple clustering technique and sparse factors allow us here to interpret the clusters in terms of a reduced set of variables. We begin with a brief introduction and motivation on sparse PCA and detail our implementation of the algorithm in d'Aspremont et al. (2005). We then apply these results to some classic clustering and feature selection problems arising in biology.",en,718,115
0147f6c1-6cd7-4819-ba11-455310472a93,Contexto: Transform the following user guide,Tutorial_Codigo,Contexto: Transform the following user guide for Vera's Lobbies into a markdown post: 'Getting started with Vera?s Lobbies can be simple...' Código de ejemplo: ```python ```python # Getting Started with Vera's Lobbies ## Installation: 1. Download the installer 2. Run the setup ## First Steps: - Create an account - Customize your settings ## Tips: - Always update to the latest version **Enjoy your experience with Vera's Lobbies!** ``` ```,en,441,70
2958eddd-2d17-4fa6-8cad-3a13b8724236,Contexto: Check if DNS is secure,Tutorial_Codigo,"Contexto: Check if DNS is secure Código de ejemplo: ```python ```python import dns.resolver try: dns.resolver.resolve('dnssec-failed.org', 'A') print('DNS is not secure.') except dns.resolver.NXDOMAIN: print('DNS is secure.') ``` ```",en,233,27
7f86114f-a62c-4f3c-812f-dbcf9e095c4b,The problem of classifying sonar signals,Articulo_Academico,"The problem of classifying sonar signals from rocks and mines first studied by Gorman and Sejnowski has become a benchmark against which many learning algorithms have been tested. We show that both the training set and the test set of this benchmark are linearly separable, although with different hyperplanes. Moreover, the complete set of learning and test patterns together, is also linearly separable. We give the weights that separate these sets, which may be used to compare results found by other algorithms.",en,515,82
ed0029d4-8fbe-4294-bab7-cf72677dfb1d,Contexto: Create a shopping list based,Tutorial_Codigo,Contexto: Create a shopping list based on my inputs! Código de ejemplo: ```python ```python shopping_list = {} while True: item = input('Enter an item or type 'done' to finish: ') if item == 'done': break quantity = input(f'Enter the quantity for {item}: ') shopping_list[item] = quantity print(f'Your shopping list: {shopping_list}') ``` ```,en,342,52
135e7574-1c3e-492e-9152-07490e94b8c8,Biogeography is the study of the,Articulo_Academico,"Biogeography is the study of the geographical distribution of biological organisms. The mindset of the engineer is that we can learn from nature. Biogeography Based Optimization is a burgeoning nature inspired technique to find the optimal solution of the problem. Satellite image classification is an important task because it is the only way we can know about the land cover map of inaccessible areas. Though satellite images have been classified in past by using various techniques, the researchers are always finding alternative strategies for satellite image classification so that they may be prepared to select the most appropriate technique for the feature extraction task in hand. This paper is focused on classification of the satellite image of a particular land cover using the theory of Biogeography based Optimization. The original BBO algorithm does not have the inbuilt property of clustering which is required during image classification. Hence modifications have been proposed to the original algorithm and the modified algorithm is used to classify the satellite image of a given region. The results indicate that highly accurate land cover features can be extracted effectively when the proposed algorithm is used.",en,1234,189
78aa9cf6-ad94-4667-8b11-92e1c9fac2f4,This paper concerns the construction of,Articulo_Academico,"This paper concerns the construction of tests for universal hypothesis testing problems, in which the alternate hypothesis is poorly modeled and the observation space is large. The mismatched universal test is a feature-based technique for this purpose. In prior work it is shown that its finite-observation performance can be much better than the (optimal) Hoeffding test, and good performance depends crucially on the choice of features. The contributions of this paper include: 1) We obtain bounds on the number of \epsilon distinguishable distributions in an exponential family. 2) This motivates a new framework for feature extraction, cast as a rank-constrained optimization problem. 3) We obtain a gradient-based algorithm to solve the rank-constrained optimization problem and prove its local convergence.",en,813,119
205dba97-eed1-44dc-b60f-641f8793829c,Nous pr\'esentons dans cette contribution une,Articulo_Academico,"Nous pr\'esentons dans cette contribution une approche \`a la fois symbolique et probabiliste permettant d'extraire l'information sur la segmentation du signal de parole \`a partir d'information prosodique. Nous utilisons pour ce faire des grammaires probabilistes poss\'edant une structure hi\'erarchique minimale. La phase de construction des grammaires ainsi que leur pouvoir de pr\'ediction sont \'evalu\'es qualitativement ainsi que quantitativement. ----- Methodologically oriented, the present work sketches an approach for prosodic information retrieval and speech segmentation, based on both symbolic and probabilistic information. We have recourse to probabilistic grammars, within which we implement a minimal hierarchical structure. Both the stages of probabilistic grammar building and its testing in prediction are explored and quantitatively and qualitatively evaluated.",fr,885,114
164dab24-5a1b-4eb6-9c10-95d575fc4ea9,We present promising results for real-time,Articulo_Academico,"We present promising results for real-time vehicle visual detection, obtained with adaBoost using new original ?keypoints presence features?. These weak-classifiers produce a boolean response based on presence or absence in the tested image of a ?keypoint? (~ a SURF interest point) with a descriptor sufficiently similar (i.e. within a given distance) to a reference descriptor characterizing the feature. A first experiment was conducted on a public image dataset containing lateral-viewed cars, yielding 95% recall with 95% precision on test set. Moreover, analysis of the positions of adaBoost-selected keypoints show that they correspond to a specific part of the object category (such as ?wheel? or ?side skirt?) and thus have a ?semantic? meaning.",en,754,112
bf3df570-98fd-4503-ae3a-52095b5fb7d4,Bounds on the risk play a,Articulo_Academico,"Bounds on the risk play a crucial role in statistical learning theory. They usually involve as capacity measure of the model studied the VC dimension or one of its extensions. In classification, such ""VC dimensions"" exist for models taking values in {0, 1}, {1,..., Q} and R. We introduce the generalizations appropriate for the missing case, the one of models with values in R^Q. This provides us with a new guaranteed risk for M-SVMs which appears superior to the existing one.",en,479,81
cc6f0f5a-f0be-4703-9fae-213e050c18c9,"In this paper, we propose a",Articulo_Academico,"In this paper, we propose a unified algorithmic framework for solving many known variants of \mds. Our algorithm is a simple iterative scheme with guaranteed convergence, and is \emph{modular}; by changing the internals of a single subroutine in the algorithm, we can switch cost functions and target spaces easily. In addition to the formal guarantees of convergence, our algorithms are accurate; in most cases, they converge to better quality solutions than existing methods, in comparable time. We expect that this framework will be useful for a number of \mds variants that have not yet been studied. Our framework extends to embedding high-dimensional points lying on a sphere to points on a lower dimensional sphere, preserving geodesic distances. As a compliment to this result, we also extend the Johnson-Lindenstrauss Lemma to this spherical setting, where projecting to a random $O((1/\eps^2) \log n)$-dimensional sphere causes $\eps$-distortion.",en,956,144
7ed422b5-005f-469b-8b01-7680287f9dfa,Contexto: Get the list of mapped,Tutorial_Codigo,"Contexto: Get the list of mapped network drives Código de ejemplo: ```python ```python import subprocess result = subprocess.run(['net', 'use'], stdout=subprocess.PIPE).stdout.decode() print('Mapped Network Drives:', result) ``` ```",en,232,26
459fe2be-007c-4016-a05e-47167df95ccb,This paper is withdrawn due to,Articulo_Academico,"This paper is withdrawn due to some errors, which are corrected in arXiv:0912.0071v4 [cs.LG].",en,93,14
db1369a0-23b9-40f0-9ced-7198eff35b99,"In this paper, we have established",Articulo_Academico,"In this paper, we have established a general framework of multistage hypothesis tests which applies to arbitrarily many mutually exclusive and exhaustive composite hypotheses. Within the new framework, we have constructed specific multistage tests which rigorously control the risk of committing decision errors and are more efficient than previous tests in terms of average sample number and the number of sampling operations. Without truncation, the sample numbers of our testing plans are absolutely bounded.",en,511,74
1580595e-b09b-42a7-bff6-156384cc37cf,Let X be randomly chosen from,Articulo_Academico,"Let X be randomly chosen from {-1,1}^n, and let Y be randomly chosen from the standard spherical Gaussian on R^n. For any (possibly unbounded) polytope P formed by the intersection of k halfspaces, we prove that |Pr [X belongs to P] - Pr [Y belongs to P]| < log^{8/5}k * Delta, where Delta is a parameter that is small for polytopes formed by the intersection of ""regular"" halfspaces (i.e., halfspaces with low influence). The novelty of our invariance principle is the polylogarithmic dependence on k. Previously, only bounds that were at least linear in k were known. We give two important applications of our main result: (1) A polylogarithmic in k bound on the Boolean noise sensitivity of intersections of k ""regular"" halfspaces (previous work gave bounds linear in k). (2) A pseudorandom generator (PRG) with seed length O((log n)*poly(log k,1/delta)) that delta-fools all polytopes with k faces with respect to the Gaussian distribution. We also obtain PRGs with similar parameters that fool polytopes formed by intersection of regular halfspaces over the hypercube. Using our PRG constructions, we obtain the first deterministic quasi-polynomial time algorithms for approximately counting the number of solutions to a broad class of integer programs, including dense covering problems and contingency tables.",en,1316,206
5a3d4823-c543-4537-a91d-16e8027807a3,Solomonoff's central result on induction is,Articulo_Academico,"Solomonoff's central result on induction is that the posterior of a universal semimeasure M converges rapidly and with probability 1 to the true sequence generating posterior mu, if the latter is computable. Hence, M is eligible as a universal sequence predictor in case of unknown mu. Despite some nearby results and proofs in the literature, the stronger result of convergence for all (Martin-Loef) random sequences remained open. Such a convergence result would be particularly interesting and natural, since randomness can be defined in terms of M itself. We show that there are universal semimeasures M which do not converge for all random sequences, i.e. we give a partial negative answer to the open problem. We also provide a positive answer for some non-universal semimeasures. We define the incomputable measure D as a mixture over all computable measures and the enumerable semimeasure W as a mixture over all enumerable nearly-measures. We show that W converges to D and D to mu on all random sequences. The Hellinger distance measuring closeness of two distributions plays a central role.",en,1101,176
