doc_id,titulo,source_type,texto,language,clean_length_chars,clean_length_words
03195912-2632-47a7-aa7c-9942d245cf8f,Actor-Critic based approaches were among the,Articulo_Academico,"Actor-Critic based approaches were among the first to address reinforcement learning in a general setting. Recently, these algorithms have gained renewed interest due to their generality, good convergence properties, and possible biological relevance. In this paper, we introduce an online temporal difference based actor-critic algorithm which is proved to converge to a neighborhood of a local maximum of the average reward. Linear function approximation is used by the critic in order estimate the value function, and the temporal difference signal, which is passed from the critic to the actor. The main distinguishing feature of the present convergence proof is that both the actor and the critic operate on a similar time scale, while in most current convergence proofs they are required to have very different time scales in order to converge. Moreover, the same temporal difference signal is used to update the parameters of both the actor and the critic. A limitation of the proposed approach, compared to results available for two time scale convergence, is that convergence is guaranteed only to a neighborhood of an optimal value, rather to an optimal value itself. The single time scale and identical temporal difference signal used by the actor and the critic, may provide a step towards constructing more biologically realistic models of reinforcement learning in the brain.",en,1389,216
a7b0ba6c-27df-45d2-8b16-168768438100,Contexto: Check for suspicious registry entries,Tutorial_Codigo,"Contexto: Check for suspicious registry entries in 'SYSTEM\\ExampleControlSet\\Services' Código de ejemplo: ```python ```python import winreg key = winreg.OpenKey(winreg.HKEY_LOCAL_MACHINE, 'SYSTEM\\ExampleControlSet\\Services') for i in range(0, winreg.QueryInfoKey(key)[0]): name = winreg.EnumKey(key, i) if 'example_suspicious_entry' in name: print(f'Suspicious registry entry detected: {name}') ``` ```",en,406,39
21b737db-d1dd-4492-83a8-692b965d5fa0,Contexto: Trace the list of system,Tutorial_Codigo,"Contexto: Trace the list of system services Código de ejemplo: ```python ```python import subprocess result = subprocess.run(['sc', 'query'], stdout=subprocess.PIPE).stdout.decode() print('System Services:', result) ``` ```",en,223,24
fecdc612-54c2-4cf1-b61f-3e456e51b8b0,Conformal prediction uses past experience to,Articulo_Academico,"Conformal prediction uses past experience to determine precise levels of confidence in new predictions. Given an error probability $\epsilon$, together with a method that makes a prediction $\hat{y}$ of a label $y$, it produces a set of labels, typically containing $\hat{y}$, that also contains $y$ with probability $1-\epsilon$. Conformal prediction can be applied to any method for producing $\hat{y}$: a nearest-neighbor method, a support-vector machine, ridge regression, etc. Conformal prediction is designed for an on-line setting in which labels are predicted successively, each one being revealed before the next is predicted. The most novel and valuable feature of conformal prediction is that if the successive examples are sampled independently from the same distribution, then the successive predictions will be right $1-\epsilon$ of the time, even though they are based on an accumulating dataset rather than on independent datasets. In addition to the model under which successive examples are sampled independently, other on-line compression models can also use conformal prediction. The widely used Gaussian linear model is one of these. This tutorial presents a self-contained account of the theory of conformal prediction and works through several numerical examples. A more comprehensive treatment of the topic is provided in ""Algorithmic Learning in a Random World"", by Vladimir Vovk, Alex Gammerman, and Glenn Shafer (Springer, 2005).",en,1456,213
7b27a409-edcf-4e4e-90b2-486c0dfc0b7e,Contexto: Show system information Código de,Tutorial_Codigo,Contexto: Show system information Código de ejemplo: ```python ```python import platform print(f'OS: {platform.system()} Version: {platform.version()} Architecture: {platform.architecture()[0]}') ``` ```,en,203,19
dacc2040-99f5-48ab-b69a-f4432b418d08,Contexto: Log errors into a file,Tutorial_Codigo,"Contexto: Log errors into a file Código de ejemplo: ```python ```python import logging logging.basicConfig(filename='logs.log', level=logging.ERROR) try: x = 1 / 0 except Exception as e: logging.error(f'An error occurred: {e}') ``` ```",en,235,31
83287d89-3be2-44b2-b916-2f5ca64ad316,Contexto: Convert all string concatenations to,Tutorial_Codigo,"Contexto: Convert all string concatenations to f-strings Código de ejemplo: ```python ```python file_path = input('Enter the Python file path: ') with open(file_path, 'r+') as f: lines = f.readlines() f.seek(0) for line in lines: if '+' in line and '""' in line: variables = re.findall(r'""(.+?)""', line) f.write(f'f""{"".join(variables)}""\n') else: f.write(line) f.truncate() ``` ```",en,380,51
479ad3c2-0958-4339-81d1-6d3eeb72380a,Contexto: Identify the current user Código,Tutorial_Codigo,"Contexto: Identify the current user Código de ejemplo: ```python ```python import getpass username = getpass.getuser() print('Current User:', username) ``` ```",en,159,20
5c4ac660-acc1-4686-a651-62feeed0a268,KNN is one of the most,Articulo_Academico,"KNN is one of the most popular classification methods, but it often fails to work well with inappropriate choice of distance metric or due to the presence of numerous class-irrelevant features. Linear feature transformation methods have been widely applied to extract class-relevant information to improve kNN classification, which is very limited in many applications. Kernels have been used to learn powerful non-linear feature transformations, but these methods fail to scale to large datasets. In this paper, we present a scalable non-linear feature mapping method based on a deep neural network pretrained with restricted boltzmann machines for improving kNN classification in a large-margin framework, which we call DNet-kNN. DNet-kNN can be used for both classification and for supervised dimensionality reduction. The experimental results on two benchmark handwritten digit datasets show that DNet-kNN has much better performance than large-margin kNN using a linear mapping and kNN based on a deep autoencoder pretrained with retricted boltzmann machines.",en,1064,154
7cf66eba-91de-4c95-9d20-b8314938439e,"Recognizing analogies, synonyms, antonyms, and associations",Articulo_Academico,"Recognizing analogies, synonyms, antonyms, and associations appear to be four distinct tasks, requiring distinct NLP algorithms. In the past, the four tasks have been treated independently, using a wide variety of algorithms. These four semantic classes, however, are a tiny sample of the full range of semantic phenomena, and we cannot afford to create ad hoc algorithms for each semantic phenomenon; we need to seek a unified approach. We propose to subsume a broad range of phenomena under analogies. To limit the scope of this paper, we restrict our attention to the subsumption of synonyms, antonyms, and associations. We introduce a supervised corpus-based machine learning algorithm for classifying analogous word pairs, and we show that it can solve multiple-choice SAT analogy questions, TOEFL synonym questions, ESL synonym-antonym questions, and similar-associated-both questions from cognitive psychology.",en,917,134
b0ba71b0-6396-4a43-8ff4-a31658c73a4d,"Recently, Adaboost has been widely used",Articulo_Academico,"Recently, Adaboost has been widely used to improve the accuracy of any given learning algorithm. In this paper we focus on designing an algorithm to employ combination of Adaboost with Support Vector Machine as weak component classifiers to be used in Face Detection Task. To obtain a set of effective SVM-weaklearner Classifier, this algorithm adaptively adjusts the kernel parameter in SVM instead of using a fixed one. Proposed combination outperforms in generalization in comparison with SVM on imbalanced classification problem. The proposed here method is compared, in terms of classification accuracy, to other commonly used Adaboost methods, such as Decision Trees and Neural Networks, on CMU+MIT face database. Results indicate that the performance of the proposed method is overall superior to previous Adaboost approaches.",en,833,124
10454e72-e40a-4995-9e2e-d61e4167a7b1,Contexto: Host an API... Código de,Tutorial_Codigo,"Contexto: Host an API... Código de ejemplo: ```python ```python from flask import Flask, jsonify app = Flask(__name__) response_data = input('Please enter the API response message: ') @app.route('/api', methods=['GET']) def api_endpoint(): return jsonify({'message': response_data}) if __name__ == '__main__': app.run(host='0.0.0.0', port=5000) ``` ```",en,352,41
ae23aedd-5f51-4862-8ed0-cc5c34d8ca78,Contexto: Launch my favorite game Código,Tutorial_Codigo,Contexto: Launch my favorite game Código de ejemplo: ```python ```python import os game_path = input('Enter the path to your favorite game executable: ') os.startfile(game_path) ``` ```,en,185,26
a13ee567-6265-4611-b2e7-2aab8f591594,Contexto: Compare my game library with,Tutorial_Codigo,"Contexto: Compare my game library with a friend's Código de ejemplo: ```python ```python your_games = input('Enter your games, separated by commas: ').split(',') friend_games = input('Enter your friend's games, separated by commas: ').split(',') common_games = set(your_games) & set(friend_games) print(f'Games you both have: {common_games}') ``` ```",en,350,44
73f26994-d71f-45c8-b44c-173c363cd078,We study the problem of dynamic,Articulo_Academico,"We study the problem of dynamic spectrum sensing and access in cognitive radio systems as a partially observed Markov decision process (POMDP). A group of cognitive users cooperatively tries to exploit vacancies in primary (licensed) channels whose occupancies follow a Markovian evolution. We first consider the scenario where the cognitive users have perfect knowledge of the distribution of the signals they receive from the primary users. For this problem, we obtain a greedy channel selection and access policy that maximizes the instantaneous reward, while satisfying a constraint on the probability of interfering with licensed transmissions. We also derive an analytical universal upper bound on the performance of the optimal policy. Through simulation, we show that our scheme achieves good performance relative to the upper bound and improved performance relative to an existing scheme. We then consider the more practical scenario where the exact distribution of the signal from the primary is unknown. We assume a parametric model for the distribution and develop an algorithm that can learn the true distribution, still guaranteeing the constraint on the interference probability. We show that this algorithm outperforms the naive design that assumes a worst case value for the parameter. We also provide a proof for the convergence of the learning algorithm.",en,1373,208
95c192d7-f9c1-44de-87c6-8fe96a0ad1e3,We provide a sound and consistent,Articulo_Academico,"We provide a sound and consistent foundation for the use of \emph{nonrandom} exploration data in ""contextual bandit"" or ""partially labeled"" settings where only the value of a chosen action is learned. The primary challenge in a variety of settings is that the exploration policy, in which ""offline"" data is logged, is not explicitly known. Prior solutions here require either control of the actions during the learning process, recorded random exploration, or actions chosen obliviously in a repeated manner. The techniques reported here lift these restrictions, allowing the learning of a policy for choosing actions given features from historical data where no randomization occurred or was logged. We empirically verify our solution on two reasonably sized sets of real-world data obtained from Yahoo!.",en,805,122
a55b8b35-8b3a-4f66-b950-1077390237f6,Contexto: Organize my movie list into,Tutorial_Codigo,"Contexto: Organize my movie list into genres! Código de ejemplo: ```python ```python movie_list = {} while True: genre = input('Enter a movie genre or type 'done' to finish: ') if genre == 'done': break movie = input(f'Enter a movie for the {genre} genre: ') movie_list.setdefault(genre, []).append(movie) print(f'Your organized movie list: {movie_list}') ``` ```",en,363,53
c1ef96db-32e4-487a-a941-1d19ebce7e4d,Contexto: Optimize network settings for online,Tutorial_Codigo,Contexto: Optimize network settings for online gaming Código de ejemplo: ```python ```python import os os.system('netsh int tcp set heuristics disabled') os.system('netsh int tcp set global autotuninglevel=normal') ``` ```,en,222,28
307f996d-fe2f-41b6-8d67-0907669db797,Contexto: Monitor CPU and GPU temperature,Tutorial_Codigo,Contexto: Monitor CPU and GPU temperature and alert if it's too high Código de ejemplo: ```python ```python import psutil threshold = float(input('Enter the temperature threshold for alert: ')) while True: cpu_temp = psutil.sensors_temperatures()['coretemp'][0].current gpu_temp = psutil.sensors_temperatures()['nvidia'][0].current if cpu_temp > threshold or gpu_temp > threshold: print('Temperature too high! Consider stopping the game.') ``` ```,en,447,53
4b738dcd-9c84-4883-befc-309aa89a8e84,We study the problem of estimating,Articulo_Academico,"We study the problem of estimating the time delay between two signals representing delayed, irregularly sampled and noisy versions of the same underlying pattern. We propose and demonstrate an evolutionary algorithm for the (hyper)parameter estimation of a kernel-based technique in the context of an astronomical problem, namely estimating the time delay between two gravitationally lensed signals from a distant quasar. Mixed types (integer and real) are used to represent variables within the evolutionary algorithm. We test the algorithm on several artificial data sets, and also on real astronomical observations of quasar Q0957+561. By carrying out a statistical analysis of the results we present a detailed comparison of our method with the most popular methods for time delay estimation in astrophysics. Our method yields more accurate and more stable time delay estimates: for Q0957+561, we obtain 419.6 days for the time delay between images A and B. Our methodology can be readily applied to current state-of-the-art optical monitoring data in astronomy, but can also be applied in other disciplines involving similar time series data.",en,1147,173
394fa8cc-469f-4ba3-90b9-cb2eae7038b2,Collecting large labeled data sets is,Articulo_Academico,"Collecting large labeled data sets is a laborious and expensive task, whose scaling up requires division of the labeling workload between many teachers. When the number of classes is large, miscorrespondences between the labels given by the different teachers are likely to occur, which, in the extreme case, may reach total inconsistency. In this paper we describe how globally consistent labels can be obtained, despite the absence of teacher coordination, and discuss the possible efficiency of this process in terms of human labor. We define a notion of label efficiency, measuring the ratio between the number of globally consistent labels obtained and the number of labels provided by distributed teachers. We show that the efficiency depends critically on the ratio alpha between the number of data instances seen by a single teacher, and the number of classes. We suggest several algorithms for the distributed labeling problem, and analyze their efficiency as a function of alpha. In addition, we provide an upper bound on label efficiency for the case of completely uncoordinated teachers, and show that efficiency approaches 0 as the ratio between the number of labels each teacher provides and the number of classes drops (i.e. alpha goes to 0).",en,1257,200
17c52661-d84b-40e5-989e-51d0d40139a3,Contexto: Visualize data using a bar,Tutorial_Codigo,"Contexto: Visualize data using a bar chart Código de ejemplo: ```python ```python import matplotlib.pyplot as plt labels = ['A', 'B', 'C'] values = [1, 4, 2] plt.bar(labels, values) plt.show() ``` ```",ca,200,31
333ac932-6b61-46ff-b7fd-1241d11ec75d,Contexto: Search for a 4K TV,Tutorial_Codigo,"Contexto: Search for a 4K TV on Ceneo Código de ejemplo: ```python ```python import requests from bs4 import BeautifulSoup def p_c(q): q = q.replace(' ', '+') u = f' res = requests.get(u) s = BeautifulSoup(res.text, 'html.parser') p = s.find('span', {'class': 'price'}) return p.text if p else 'Not found' print(p_c('4K TV')) ``` ```",en,333,52
d605c984-2d94-4d7c-b0a6-dded0d0551dd,Contexto: Perform arithmetic on 10 and,Tutorial_Codigo,"Contexto: Perform arithmetic on 10 and 5 Código de ejemplo: ```python ```python def add(a, b): return a + b def subtract(a, b): return a - b def multiply(a, b): return a * b def divide(a, b): if b != 0: return a / b else: return 'Cannot divide by zero' ``` ```",en,260,52
3c493071-6577-4d98-bf93-85db12f16a8b,Maximum likelihood estimators are often of,Articulo_Academico,"Maximum likelihood estimators are often of limited practical use due to the intensive computation they require. We propose a family of alternative estimators that maximize a stochastic variation of the composite likelihood function. Each of the estimators resolve the computation-accuracy tradeoff differently, and taken together they span a continuous spectrum of computation-accuracy tradeoff resolutions. We prove the consistency of the estimators, provide formulas for their asymptotic variance, statistical robustness, and computational complexity. We discuss experimental results in the context of Boltzmann machines and conditional random fields. The theoretical and experimental studies demonstrate the effectiveness of the estimators when the computational resources are insufficient. They also demonstrate that in some cases reduced computational complexity is associated with robustness thereby increasing statistical accuracy.",en,938,121
794870e9-79e4-4135-99a7-52ecbe6a74e2,Minimizing the rank of a matrix,Articulo_Academico,"Minimizing the rank of a matrix subject to affine constraints is a fundamental problem with many important applications in machine learning and statistics. In this paper we propose a simple and fast algorithm SVP (Singular Value Projection) for rank minimization with affine constraints (ARMP) and show that SVP recovers the minimum rank solution for affine constraints that satisfy the ""restricted isometry property"" and show robustness of our method to noise. Our results improve upon a recent breakthrough by Recht, Fazel and Parillo (RFP07) and Lee and Bresler (LB09) in three significant ways: 1) our method (SVP) is significantly simpler to analyze and easier to implement, 2) we give recovery guarantees under strictly weaker isometry assumptions 3) we give geometric convergence guarantees for SVP even in presense of noise and, as demonstrated empirically, SVP is significantly faster on real-world and synthetic problems. In addition, we address the practically important problem of low-rank matrix completion (MCP), which can be seen as a special case of ARMP. We empirically demonstrate that our algorithm recovers low-rank incoherent matrices from an almost optimal number of uniformly sampled entries. We make partial progress towards proving exact recovery and provide some intuition for the strong performance of SVP applied to matrix completion by showing a more restricted isometry property. Our algorithm outperforms existing methods, such as those of \cite{RFP07,CR08,CT09,CCS08,KOM09,LB09}, for ARMP and the matrix-completion problem by an order of magnitude and is also significantly more robust to noise.",en,1627,241
eb5f37ca-ac3b-4c8a-b40a-dee30922f232,Contexto: Send an email with the,Tutorial_Codigo,"Contexto: Send an email with the subject 'Short' Código de ejemplo: ```python ```python import smtplib, schedule, time def se(): s = smtplib.SMTP('smtp.gmail.com', 587) s.starttls() s.login('shortsubject@gmail.com', 'short123456789012') s.sendmail('shortsubject@gmail.com', 'shortsubject@gmail.com', 'Subject: Short Content.') s.quit() print('E sent.') schedule.every().day.at('03:46').do(se) while True: schedule.run_pending() time.sleep(1) ``` ```",en,449,41
4beb5f67-8f12-445a-8b0c-bf1e7ea2f791,"We study the tracking problem, namely,",Articulo_Academico,"We study the tracking problem, namely, estimating the hidden state of an object over time, from unreliable and noisy measurements. The standard framework for the tracking problem is the generative framework, which is the basis of solutions such as the Bayesian algorithm and its approximation, the particle filters. However, the problem with these solutions is that they are very sensitive to model mismatches. In this paper, motivated by online learning, we introduce a new framework -- an {\em explanatory} framework -- for tracking. We provide an efficient tracking algorithm for this framework. We provide experimental results comparing our algorithm to the Bayesian algorithm on simulated data. Our experiments show that when there are slight model mismatches, our algorithm vastly outperforms the Bayesian algorithm.",en,822,123
6f840f75-d893-44f7-8587-0d3f64c74de1,Contexto: Dim the screen brightness for,Tutorial_Codigo,Contexto: Dim the screen brightness for movie mode Código de ejemplo: ```python ```python import screen_brightness_control as sbc sbc.set_brightness(20) ``` ```,en,160,20
acec3e9e-94f7-44e1-892c-7a270cacc233,Contexto: Decrypting SSL traffic with ssldump,Tutorial_Codigo,Contexto: Decrypting SSL traffic with ssldump in Linux. Código de ejemplo: ```python ```python #!/bin/bash ssldump -r file.pcap -k server.key -CA ca.crt ``` ```,en,160,23
10c1a4f3-d113-434c-9167-616d5fcc54e7,Contexto: List the top 5 movies,Tutorial_Codigo,"Contexto: List the top 5 movies on Netflix Código de ejemplo: ```python ```python import requests from bs4 import BeautifulSoup response = requests.get(' soup = BeautifulSoup(response.text, 'html.parser') top_movies = soup.select('.top-movie-title') for movie in top_movies[:5]: print(movie.text) ``` ```",en,304,36
70e8c6c0-59d7-4480-90af-55944fcb1075,Contexto: Toggle airplane mode Código de,Tutorial_Codigo,Contexto: Toggle airplane mode Código de ejemplo: ```python ```python import os os.system('airplane-mode toggle') ``` ```,fr,121,15
b9a52b88-f27d-4c50-ab6a-7ffbabfe4bdb,We present a practical and statistically,Articulo_Academico,"We present a practical and statistically consistent scheme for actively learning binary classifiers under general loss functions. Our algorithm uses importance weighting to correct sampling bias, and by controlling the variance, we are able to give rigorous label complexity bounds for the learning process. Experiments on passively labeled data show that this approach reduces the label complexity required to achieve good predictive performance on many learning problems.",en,473,67
637747d4-89b7-458a-90df-66b1a6206ea1,Observations consisting of measurements on relationships,Articulo_Academico,"Observations consisting of measurements on relationships for pairs of objects arise in many settings, such as protein interaction and gene regulatory networks, collections of author-recipient email, and social networks. Analyzing such data with probabilisic models can be delicate because the simple exchangeability assumptions underlying many boilerplate models no longer hold. In this paper, we describe a latent variable model of such data called the mixed membership stochastic blockmodel. This model extends blockmodels for relational data to ones which capture mixed membership latent relational structure, thus providing an object-specific low-dimensional representation. We develop a general variational inference algorithm for fast approximate posterior inference. We explore applications to social and protein interaction networks.",en,841,111
c3ed5f1a-8ab7-4dbb-9db3-42bfaa1dbb9a,Contexto: Turn the following tutorial for,Tutorial_Codigo,"Contexto: Turn the following tutorial for Vera's Lobbies into a markdown post: 'We've put together a step-by-step guide to help you get the most out of Vera's Lobbies...' Código de ejemplo: ```python ```python # Step-by-Step Tutorial for Vera's Lobbies Welcome to the ultimate guide for Vera's Lobbies. ## Sections: - [Getting Started](#getting-started) - [Advanced Features](#advanced-features) - [Troubleshooting](#troubleshooting) ### Getting Started 1. **Download the App** - Visit our website to download the latest version. 2. **Create an Account** - Follow the on-screen instructions. ### Advanced Features 1. **Setting Up the Lobby** - How to customize your personal lobby. 2. **Using the Shoutbox** - A guide to effective communication. ### Troubleshooting 1. **Connectivity Issues** - Steps to resolve common network problems. 2. **Account Recovery** - How to regain access to your account. **For more tutorials, visit our [Learning Center]( ``` ```",en,959,139
